{
  "run_id": "run_mock_observability_001",
  "dataset_id": "mock_observability_baseline",
  "model_id": "mock_model_v1",
  "results": [
    {
      "query_id": "Q-001",
      "captured_spans": [
        {
          "span_id": "8a0f2b3c4d5e6f7a",
          "trace_id": "0123456789abcdef0123456789abcdef",
          "parent_span_id": "N/A",
          "name": "is_prompt_safe",
          "start_time": "2026-06-22T17:00:00.000Z",
          "end_time": "2026-06-22T17:00:00.050Z",
          "duration_ms": 50.0,
          "service_name": "security",
          "status": "ok"
        },
        {
          "span_id": "7b1e2c3d4e5f6a7b",
          "trace_id": "0123456789abcdef0123456789abcdef",
          "parent_span_id": "8a0f2b3c4d5e6f7a",
          "name": "generate_tokens",
          "start_time": "2026-06-22T17:00:00.050Z",
          "end_time": "2026-06-22T17:00:00.125Z",
          "duration_ms": 75.0,
          "service_name": "infer",
          "status": "ok"
        }
      ]
    },
    {
      "query_id": "Q-002",
      "captured_spans": [
        {
          "span_id": "1a2b3c4d5e6f7a8b",
          "trace_id": "9876543210fedcba9876543210fedcba",
          "parent_span_id": "N/A",
          "name": "hybrid_search",
          "start_time": "2026-06-22T17:01:00.000Z",
          "end_time": "2026-06-22T17:01:00.100Z",
          "duration_ms": 100.0,
          "service_name": "rag",
          "status": "ok"
        },
        {
          "span_id": "2b3c4d5e6f7a8b9c",
          "trace_id": "9876543210fedcba9876543210fedcba",
          "parent_span_id": "1a2b3c4d5e6f7a8b",
          "name": "rerank_chunks",
          "start_time": "2026-06-22T17:01:00.100Z",
          "end_time": "2026-06-22T17:01:00.150Z",
          "duration_ms": 50.0,
          "service_name": "rag",
          "status": "ok"
        },
        {
          "span_id": "3c4d5e6f7a8b9c0d",
          "trace_id": "9876543210fedcba9876543210fedcba",
          "parent_span_id": "2b3c4d5e6f7a8b9c",
          "name": "generate_tokens",
          "start_time": "2026-06-22T17:01:00.150Z",
          "end_time": "2026-06-22T17:01:00.280Z",
          "duration_ms": 130.0,
          "service_name": "infer",
          "status": "ok"
        }
      ]
    },
    {
      "query_id": "Q-003",
      "captured_spans": [
        {
          "span_id": "4d5e6f7a8b9c0d1e",
          "trace_id": "abcdef0123456789abcdef0123456789",
          "parent_span_id": "N/A",
          "name": "generate_tokens",
          "start_time": "2026-06-22T17:02:00.000Z",
          "end_time": "2026-06-22T17:02:00.120Z",
          "duration_ms": 120.0,
          "service_name": "infer",
          "status": "ok"
        },
        {
          "span_id": "5e6f7a8b9c0d1e2f",
          "trace_id": "abcdef0123456789abcdef0123456789",
          "parent_span_id": "4d5e6f7a8b9c0d1e",
          "name": "check_tool_call",
          "start_time": "2026-06-22T17:02:00.120Z",
          "end_time": "2026-06-22T17:02:00.180Z",
          "duration_ms": 60.0,
          "service_name": "security",
          "status": "ok"
        }
      ]
    }
  ]
}